{
  "run_id": "daily-2026-10-11",
  "task_type": "daily",
  "status": "degraded",
  "started_at": "2026-10-11T01:15:18Z",
  "completed_at": "2026-10-11T01:20:00Z",
  "coverage_start": "2026-09-22T01:18:58Z",
  "coverage_end": "2026-10-11T01:15:18Z",
  "previous_successful_coverage_end": "2026-09-24T01:18:58Z",
  "queries": [
    {
      "query": "site:arxiv.org PDE foundation model pretraining October 2026",
      "source": "websearch",
      "status": "success",
      "error": null,
      "candidate_ids": []
    },
    {
      "query": "site:arxiv.org multiple physics pretraining neural operator 2610",
      "source": "websearch",
      "status": "success",
      "error": null,
      "candidate_ids": []
    },
    {
      "query": "site:arxiv.org PDE benchmark dataset scaling laws scientific machine learning 2610",
      "source": "websearch",
      "status": "success",
      "error": null,
      "candidate_ids": []
    },
    {
      "query": "site:arxiv.org neural operator PDE surrogate zero-shot generalization 2610",
      "source": "websearch",
      "status": "success",
      "error": null,
      "candidate_ids": []
    },
    {
      "query": "export.arxiv.org API all:PDE foundation model",
      "source": "arxiv",
      "status": "failed",
      "error": "curl returned HTTP 000 (connection/DNS failure)",
      "candidate_ids": []
    }
  ],
  "candidates": [],
  "digest_path": "digests/PDE-FM-日报-20261011.md"
}
