{
  "run_id": "daily-2026-10-07",
  "task_type": "daily",
  "status": "degraded",
  "started_at": "2026-10-07T01:15:28Z",
  "completed_at": "2026-10-07T01:15:54Z",
  "coverage_start": "2026-09-22T01:18:58Z",
  "coverage_end": "2026-10-07T01:15:28Z",
  "previous_successful_coverage_end": "2026-09-24T01:18:58Z",
  "queries": [
    {"query": "arxiv PDE foundation model pretraining October 2026", "source": "websearch", "status": "success", "error": null, "candidate_ids": []},
    {"query": "arxiv neural operator PDE benchmark scaling laws 2610", "source": "websearch", "status": "success", "error": null, "candidate_ids": []},
    {"query": "arxiv zero-shot PDE generalization fine-tuning foundation model 2610", "source": "websearch", "status": "success", "error": null, "candidate_ids": []},
    {"query": "arxiv physics-informed neural network surrogate model PDE 2610", "source": "websearch", "status": "success", "error": null, "candidate_ids": []},
    {"query": "export.arxiv.org API all:PDE foundation model", "source": "arxiv", "status": "failed", "error": "HTTP 403 CONNECT tunnel failed", "candidate_ids": []}
  ],
  "candidates": [],
  "digest_path": "digests/PDE-FM-日报-20261007.md"
}
