{
  "run_id": "daily-2026-10-04",
  "task_type": "daily",
  "status": "degraded",
  "started_at": "2026-10-04T01:15:31Z",
  "completed_at": "2026-10-04T01:22:00Z",
  "coverage_start": "2026-09-22T01:18:58Z",
  "coverage_end": "2026-10-04T01:15:31Z",
  "previous_successful_coverage_end": "2026-09-24T01:18:58Z",
  "queries": [
    {"query": "arXiv PDE foundation model pretraining multiple physics 2610", "source": "websearch", "status": "success", "error": null, "candidate_ids": []},
    {"query": "arxiv 2610 neural operator partial differential equations", "source": "websearch", "status": "success", "error": null, "candidate_ids": []},
    {"query": "arxiv 2610 PDE benchmark dataset scaling laws scientific machine learning", "source": "websearch", "status": "success", "error": null, "candidate_ids": []},
    {"query": "arxiv October 2026 zero-shot fine-tuning PDE foundation model generalization", "source": "websearch", "status": "success", "error": null, "candidate_ids": []},
    {"query": "export.arxiv.org API all:\"PDE foundation model\"", "source": "arxiv", "status": "failed", "error": "proxy denied CONNECT to export.arxiv.org:443 (HTTP 403)", "candidate_ids": []}
  ],
  "candidates": [],
  "digest_path": "digests/PDE-FM-日报-20261004.md"
}
