{
  "run_id": "example.daily.zero-results",
  "task_type": "daily",
  "status": "success",
  "started_at": "2026-09-12T00:00:00Z",
  "completed_at": "2026-09-12T01:00:00Z",
  "coverage_start": "2026-09-10T00:00:00Z",
  "coverage_end": "2026-09-12T00:00:00Z",
  "previous_successful_coverage_end": "2026-09-11T00:00:00Z",
  "queries": [
    {
      "query": "synthetic fixture only; do not import",
      "source": "example.org",
      "status": "success",
      "candidate_ids": []
    }
  ],
  "candidates": []
}
