{
  "run_id": "daily-2026-10-12",
  "task_type": "daily",
  "started_at": "2026-10-12T01:15:21Z",
  "completed_at": "2026-10-12T01:25:00Z",
  "coverage_start": "2026-09-22T01:18:58Z",
  "coverage_end": "2026-10-12T01:15:23Z",
  "previous_successful_coverage_end": "2026-09-24T01:18:58Z",
  "status": "degraded",
  "queries": [
    {
      "query": "site:arxiv.org PDE foundation model pretraining",
      "source": "websearch",
      "status": "success",
      "error": null,
      "candidate_ids": []
    },
    {
      "query": "site:arxiv.org multiple physics pretraining neural operator October 2026",
      "source": "websearch",
      "status": "success",
      "error": null,
      "candidate_ids": []
    },
    {
      "query": "site:arxiv.org PDE benchmark dataset scaling laws scientific machine learning",
      "source": "websearch",
      "status": "success",
      "error": null,
      "candidate_ids": []
    },
    {
      "query": "site:arxiv.org zero-shot fine-tuning foundation model PDE neural operator generalization",
      "source": "websearch",
      "status": "success",
      "error": null,
      "candidate_ids": []
    },
    {
      "query": "site:arxiv.org neural operator surrogate PDE 2610",
      "source": "websearch",
      "status": "success",
      "error": null,
      "candidate_ids": []
    },
    {
      "query": "all:\"foundation model\" AND all:PDE (export.arxiv.org API)",
      "source": "arxiv",
      "status": "failed",
      "error": "Could not resolve host: export.arxiv.org",
      "candidate_ids": []
    }
  ],
  "candidates": [],
  "digest_path": "digests/PDE-FM-日报-20261012.md"
}