{
  "run_id": "daily-2026-09-13",
  "task_type": "daily",
  "status": "success",
  "started_at": "2026-09-13T01:07:38Z",
  "completed_at": "2026-09-13T02:10:00Z",
  "coverage_start": "2026-09-11T01:07:38Z",
  "coverage_end": "2026-09-13T01:07:38Z",
  "previous_successful_coverage_end": null,
  "queries": [
    {"query": "site:arxiv.org PDE foundation model September 2026", "source": "websearch", "status": "success", "candidate_ids": []},
    {"query": "site:arxiv.org multiple physics pretraining foundation model 2026", "source": "websearch", "status": "success", "candidate_ids": []},
    {"query": "site:arxiv.org in-context operator learning neural operator September 2026", "source": "websearch", "status": "success", "candidate_ids": []},
    {"query": "site:arxiv.org universal PDE solver transformer pretrained 2026", "source": "websearch", "status": "success", "candidate_ids": []},
    {"query": "site:arxiv.org scaling laws scientific machine learning PDE 2026", "source": "websearch", "status": "success", "candidate_ids": []},
    {"query": "site:arxiv.org large-scale physics dataset foundation model benchmark 2026", "source": "websearch", "status": "success", "candidate_ids": []},
    {"query": "site:arxiv.org 2609 PDE foundation model neural operator", "source": "websearch", "status": "success", "candidate_ids": []},
    {"query": "site:arxiv.org zero-shot PDE neural operator generalization September 2026", "source": "websearch", "status": "success", "candidate_ids": []},
    {"query": "site:arxiv.org fine-tuning foundation model PDE downstream parameter-efficient 2026", "source": "websearch", "status": "success", "candidate_ids": []},
    {"query": "site:arxiv.org neural operator PDE solver September 2026", "source": "websearch", "status": "success", "candidate_ids": []},
    {"query": "site:arxiv.org physics-informed neural network September 2026", "source": "websearch", "status": "success", "candidate_ids": ["2609.11628"]},
    {"query": "site:arxiv.org surrogate model PDE simulation machine learning September 2026", "source": "websearch", "status": "success", "candidate_ids": []},
    {"query": "site:arxiv.org 2609 neural operator generalization foundation", "source": "websearch", "status": "success", "candidate_ids": ["2609.03069"]},
    {"query": "site:arxiv.org generative model PDE scientific data diffusion flow matching September 2026", "source": "websearch", "status": "success", "candidate_ids": []},
    {"query": "site:arxiv.org PDE benchmark dataset machine learning evaluation September 2026", "source": "websearch", "status": "success", "candidate_ids": []},
    {"query": "site:arxiv.org active learning neural operator data-efficient September 2026", "source": "websearch", "status": "success", "candidate_ids": []},
    {"query": "site:arxiv.org out-of-distribution generalization neural PDE 2609", "source": "websearch", "status": "success", "candidate_ids": []},
    {"query": "site:arxiv.org token化 patch representation physics field transformer large-scale PDE 2026", "source": "websearch", "status": "success", "candidate_ids": []},
    {"query": "site:arxiv.org 2609.10 OR 2609.09 OR 2609.11 PDE neural operator transformer", "source": "websearch", "status": "success", "candidate_ids": []},
    {"query": "site:arxiv.org reduced-order model machine learning PDE September 2026", "source": "websearch", "status": "success", "candidate_ids": []},
    {"query": "site:arxiv.org graph neural network PDE simulation September 2026", "source": "websearch", "status": "success", "candidate_ids": []},
    {"query": "site:arxiv.org scientific machine learning PDE 2609", "source": "websearch", "status": "success", "candidate_ids": ["2609.05012", "2609.07061", "2609.07752", "2609.08034"]},
    {"query": "arxiv September 11 12 2026 new PDE foundation model preprint", "source": "websearch", "status": "success", "candidate_ids": []},
    {"query": "site:arxiv.org foundation model transfer new PDE geometry few-shot September 2026", "source": "websearch", "status": "success", "candidate_ids": []},
    {"query": "site:arxiv.org The Well PDEBench PDEArena multi-physics dataset 2609", "source": "websearch", "status": "success", "candidate_ids": []},
    {"query": "arxiv 2609.07061 PhysSAE mechanistic interpretability sparse autoencoders PINN abstract", "source": "websearch", "status": "success", "candidate_ids": ["2609.07061"]},
    {"query": "arxiv 2609.08034 Two-Scale Localized PCA-Net abstract", "source": "websearch", "status": "success", "candidate_ids": ["2609.08034"]}
  ],
  "candidates": [
    {
      "arxiv_id": "2609.07061",
      "submitted_at": null,
      "updated_at": null,
      "discovered_at": "2026-09-13T01:40:00Z",
      "decision": "excluded",
      "reason": "PhysSAE：PINN倒数第二层激活训练稀疏自编码器做机制可解释性，跨6类PDE用因果干预诊断PINN学到/未学到的结构，方法有D方向诊断价值但为单一PINN诊断工具，无多物理预训练/规模化/可迁移性证据，估约5-6分，未达阈值",
      "discovery_type": "backfill"
    },
    {
      "arxiv_id": "2609.08034",
      "submitted_at": null,
      "updated_at": null,
      "discovered_at": "2026-09-13T01:45:00Z",
      "decision": "excluded",
      "reason": "Two-Scale Localized PCA-Net：局部PCA算子学习粗全局+细节残差两级分解，缓解分块拼接伪影，单一架构效率改进，无多物理预训练或跨方程可迁移性证据，估约4-5分，未达阈值",
      "discovery_type": "backfill"
    },
    {
      "arxiv_id": "2609.11628",
      "submitted_at": null,
      "updated_at": null,
      "discovered_at": "2026-09-13T01:35:00Z",
      "decision": "excluded",
      "reason": "仿星器刮削层垂直能量输运系数反演PINN，窄应用单方程单一装置场景，缺乏通用性/可迁移性证据，估约3-4分，未达阈值",
      "discovery_type": "backfill"
    },
    {
      "arxiv_id": "2609.03069",
      "submitted_at": null,
      "updated_at": null,
      "discovered_at": "2026-09-13T01:20:00Z",
      "decision": "excluded",
      "reason": "Learnable composition for neural operators：算子学习可组合性/本地预训练+组合级迁移设计原则讨论，此前2026-09-05至2026-09-12多期run_log已核验约5分（仅Darcy/翼型两任务验证，缺乏多物理证据），本期复检结论不变，未达阈值",
      "discovery_type": "backfill"
    },
    {
      "arxiv_id": "2609.05012",
      "submitted_at": null,
      "updated_at": null,
      "discovered_at": "2026-09-13T01:25:00Z",
      "discovery_type": "backfill",
      "decision": "excluded",
      "reason": "联邦学习跨PDE解空间异质性对训练动力学的影响分析，与PDE基座大模型主线（架构/预训练/规模化）关联较弱，此前2026-09-09 run_log已核验约5-6分，本期复检结论不变，未达阈值"
    },
    {
      "arxiv_id": "2609.07752",
      "submitted_at": null,
      "updated_at": null,
      "discovered_at": "2026-09-13T01:30:00Z",
      "discovery_type": "backfill",
      "decision": "excluded",
      "reason": "LGNO局部梯度神经算子，仅单一力学场景验证，缺乏多物理/规模化证据，此前2026-09-12 run_log已核验约4-5分，本期复检结论不变，未达阈值"
    }
  ],
  "digest_path": "digests/PDE-FM-日报-20260913.md"
}
